<?xml version="1.0"?>
<!DOCTYPE benchmark PUBLIC "+//IDN sosy-lab.org//DTD BenchExec benchmark 1.9//EN" "http://www.sosy-lab.org/benchexec/benchmark-1.9.dtd">
<!-- Example file for benchmark definition for BenchExec
     with dummy tool "rand" that simply returns random answers.
     No resource limits are specified. -->
<benchmark tool="rand">

  <!-- <rundefinition> defines a tool configuration to benchmark
       (tool rand does not need any arguments and has only one configuration). -->
  <rundefinition/>

  <!-- <tasks> defines a set of tasks:
       we define three sets of some arbitrary example files here. -->
  <tasks name="DTD files">
    <include>*.dtd</include>
  </tasks>

  <tasks name="Markdown files">
    <include>*.md</include>
  </tasks>

  <tasks name="XML files">
    <include>*.xml</include>
  </tasks>

  <!-- <tasks> with <withoutfile> allows to define tasks without input files,
       if the tool supports this. -->
  <tasks name="Dummy tasks">
    <withoutfile>dummy task 1</withoutfile>
    <withoutfile>dummy task 2</withoutfile>
    <withoutfile>dummy task 3</withoutfile>
  </tasks>
</benchmark>
